{"room_id": "room-auto-dream-20260828-0511-native-window-v000-local3d-s90313", "frames_ref": "runs/local_3d-seed-90313/field.json", "dimension": 3, "lenses": [{"lens": "phase", "source": {"field": "arg(psi)", "unit": "rad"}, "mapping": {"transform": "linear", "cyclic": true, "clipping": "none"}, "geometry": "volume", "honesty": {"decorative_particles": false, "interpolated_for_display": true, "changes_physics": false}}, {"lens": "density", "source": {"field": "abs(psi)^2", "unit": "n"}, "mapping": {"transform": "linear", "cyclic": false, "clipping": "none"}, "geometry": "volume", "honesty": {"decorative_particles": false, "interpolated_for_display": true, "changes_physics": false}}], "data_source": "physics", "separated_from_physics_data": true}