{"room_id": "room-auto-dream-20260813-0166-native-window-v000-2dscreen-s88466", "frames_ref": "runs/2d_screen-seed-88466/field.json", "dimension": 2, "lenses": [{"lens": "phase", "source": {"field": "arg(psi)", "unit": "rad"}, "mapping": {"transform": "linear", "cyclic": true, "clipping": "none"}, "geometry": "plane", "honesty": {"decorative_particles": false, "interpolated_for_display": true, "changes_physics": false}}, {"lens": "density", "source": {"field": "abs(psi)^2", "unit": "n"}, "mapping": {"transform": "linear", "cyclic": false, "clipping": "none"}, "geometry": "plane", "honesty": {"decorative_particles": false, "interpolated_for_display": true, "changes_physics": false}}], "data_source": "physics", "separated_from_physics_data": true}